{
  "$schema": "./task-graph.schema.json",
  "schemaVersion": 1,
  "scope": "agent-orchestration-migration",
  "authority": {
    "authoritativeForPatterns": [
      "AO-*"
    ],
    "fallbackQueue": "docs/content-roadmap.md",
    "notes": "Compatibility mode: this graph governs only AO-* migration work. Product/game work remains selected from docs/content-roadmap.md until an explicit cutover phase is verified."
  },
  "tasks": [
    {
      "id": "AO-1",
      "title": "Establish machine-readable task graph foundation",
      "priority": 10,
      "status": "verified",
      "dependsOn": [],
      "acceptance": [
        "A versioned task-graph schema and migration graph are committed without changing product-roadmap authority.",
        "Repository-local validation rejects duplicate IDs, unknown dependencies, dependency cycles, invalid active/ready states, and malformed proof metadata.",
        "A deterministic next-task selector honors active work, dependencies, and priority.",
        "A focused CI workflow validates the orchestration foundation when its files change.",
        "AGENTS.md documents the compatibility boundary so P28 selection behavior is unchanged."
      ],
      "affectedDomains": [
        "agent-orchestration",
        "repository-governance"
      ],
      "proofs": [
        {
          "id": "graph-tests",
          "kind": "test",
          "required": true,
          "description": "Task graph validator and selector regression tests pass.",
          "command": "node agent/tests/task-graph.mjs"
        },
        {
          "id": "graph-cli",
          "kind": "test",
          "required": true,
          "description": "The repository graph validates and the selector resolves AO-1 deterministically.",
          "command": "node agent/tools/validate-task-graph.mjs && node agent/tools/next-task.mjs --json"
        },
        {
          "id": "orchestration-ci",
          "kind": "ci",
          "required": true,
          "description": "Agent Orchestration CI passes on the exact candidate revision."
        },
        {
          "id": "compatibility-boundary",
          "kind": "invariant",
          "required": true,
          "description": "docs/content-roadmap.md remains authoritative for product/game task selection during compatibility mode."
        }
      ],
      "externalDependencies": []
    },
    {
      "id": "AO-2",
      "title": "Add roadmap compatibility adapter and sidecar task metadata",
      "priority": 20,
      "status": "verified",
      "dependsOn": [
        "AO-1"
      ],
      "acceptance": [
        "Active roadmap items can be represented in the graph without manually duplicating their acceptance text.",
        "Roadmap order remains authoritative while dependency and proof metadata become machine-readable.",
        "Drift between roadmap IDs and graph metadata fails validation."
      ],
      "affectedDomains": [
        "agent-orchestration",
        "roadmap"
      ],
      "proofs": [
        {
          "id": "roadmap-adapter-tests",
          "kind": "test",
          "required": true,
          "description": "Roadmap parsing, graph materialization, ID/order matching, sync behavior, and drift detection tests pass.",
          "command": "node agent/tests/roadmap-adapter.mjs"
        },
        {
          "id": "roadmap-adapter-cli",
          "kind": "test",
          "required": true,
          "description": "The active Markdown roadmap and sidecar are synchronized and materialize into a valid product task graph.",
          "command": "node agent/tools/sync-roadmap-metadata.mjs --check && node agent/tools/roadmap-adapter.mjs --validate-only"
        },
        {
          "id": "roadmap-compatibility-ci",
          "kind": "ci",
          "required": true,
          "description": "Agent Orchestration CI passes the roadmap adapter and drift checks on the exact candidate revision."
        }
      ],
      "externalDependencies": []
    },
    {
      "id": "AO-3",
      "title": "Add change-impact and affected-verification selection",
      "priority": 30,
      "status": "verified",
      "dependsOn": [
        "AO-2"
      ],
      "acceptance": [
        "Changed files map to affected domains and focused verification commands.",
        "Unknown or high-risk impact expands verification rather than silently under-testing.",
        "Selection output is deterministic and machine-readable."
      ],
      "affectedDomains": [
        "agent-orchestration",
        "verification",
        "testing"
      ],
      "proofs": [
        {
          "id": "impact-tests",
          "kind": "test",
          "required": true,
          "description": "Impact-map validation, glob matching, deterministic selection, escalation, and de-duplication regressions pass.",
          "command": "node agent/tests/affected-verification.mjs"
        },
        {
          "id": "impact-cli",
          "kind": "test",
          "required": true,
          "description": "The repository impact map validates and representative P28 graphics changes resolve to machine-readable targeted checks.",
          "command": "node agent/tools/select-affected-verification.mjs --validate-only && node agent/tools/select-affected-verification.mjs --files scripts/prepare-refinery-premium-surfaces.mjs,src/game/graphicsAssetManifest.ts --json"
        },
        {
          "id": "impact-ci",
          "kind": "ci",
          "required": true,
          "description": "Agent Orchestration CI passes the affected-verification map, representative selector run, and regressions on the exact candidate revision."
        }
      ],
      "externalDependencies": []
    },
    {
      "id": "AO-4",
      "title": "Add exact-candidate manifest and verification ledger",
      "priority": 40,
      "status": "verified",
      "dependsOn": [
        "AO-3"
      ],
      "acceptance": [
        "Final candidates record task ID, base/head SHA, changed files, required proofs, CI evidence, artifact identity, and unresolved external QA.",
        "Verification evidence cannot be credited to a different candidate SHA.",
        "Future agents can read compact proof records instead of reconstructing completion from PR history."
      ],
      "affectedDomains": [
        "agent-orchestration",
        "verification",
        "artifacts"
      ],
      "proofs": [
        {
          "id": "candidate-evidence-tests",
          "kind": "test",
          "required": true,
          "description": "Candidate-manifest and verification-ledger integrity regressions reject cross-SHA evidence and manifest tampering.",
          "command": "node agent/tests/candidate-evidence.mjs"
        },
        {
          "id": "candidate-evidence-cli",
          "kind": "test",
          "required": true,
          "description": "The active AO task can generate and strictly validate a manifest and ledger from the exact PR base/head candidate.",
          "command": "node agent/tools/candidate-evidence.mjs manifest --task active --base <base-sha> --head <head-sha> --branch <branch> --output .agent-evidence/candidate-manifest.json"
        },
        {
          "id": "candidate-evidence-ci",
          "kind": "ci",
          "required": true,
          "description": "Agent Orchestration CI checks out the exact PR head SHA and publishes a validated candidate manifest plus verification ledger artifact for the successful candidate."
        }
      ],
      "externalDependencies": []
    },
    {
      "id": "AO-5",
      "title": "Deduplicate final verification and reuse candidate artifacts",
      "priority": 50,
      "status": "verified",
      "dependsOn": [
        "AO-4"
      ],
      "acceptance": [
        "Expensive full-repository verification runs once for the exact final candidate unless evidence requires a rerun.",
        "Browser and Android validation consume reusable outputs from the same candidate where technically safe.",
        "Focused iteration remains fast while final release confidence is preserved."
      ],
      "affectedDomains": [
        "ci",
        "verification",
        "android",
        "browser-e2e"
      ],
      "proofs": [
        {
          "id": "candidate-artifact-tests",
          "kind": "test",
          "required": true,
          "description": "Candidate web artifact identity and integrity regressions reject wrong-SHA or modified bundles.",
          "command": "node agent/tests/candidate-artifact.mjs"
        },
        {
          "id": "single-final-verification",
          "kind": "invariant",
          "required": true,
          "description": "PR orchestration contains exactly one full-repository verification/production-build producer for the candidate web bundle."
        },
        {
          "id": "browser-artifact-reuse",
          "kind": "ci",
          "required": true,
          "description": "Desktop and mobile browser validation consume the same exact-SHA candidate web artifact instead of rebuilding it."
        },
        {
          "id": "android-artifact-reuse",
          "kind": "ci",
          "required": true,
          "description": "Android packaging consumes the same exact-SHA candidate web artifact and Android emulator jobs reuse the resulting APK artifact."
        }
      ],
      "externalDependencies": []
    },
    {
      "id": "AO-6",
      "title": "Add mandatory independent review and mechanical architecture proofs",
      "priority": 60,
      "status": "verified",
      "dependsOn": [
        "AO-5"
      ],
      "acceptance": [
        "Final candidates support a separate read-only verifier context that attempts to disprove completion without creating a competing implementation.",
        "Final PR verification requires an actual trusted independent-review pass result bound to the exact current candidate SHA; missing, stale, malformed, or failed review evidence blocks completion.",